{
  "task_id": "task_01J8ZQ5N7P",
  "tenant_id": "default",
  "user_id": "u_123",
  "parent_task_id": null,
  "status": "running",
  "source": "api",
  "title": "记录一笔餐饮支出",
  "subtitle": "记账 · 票据录入",
  "progress": 0.5,
  "mode": "async",
  "mode_changed": false,
  "mode_change_reason": null,
  "profile": {
    "profile_version": "1.0",
    "policy_version": "pv_2026-10-01_03",
    "task_type": "bookkeeping.capture_from_receipt",
    "intent_summary": "用户上传一张支付截图并附文字，意图记录一笔餐饮支出。",
    "modality": ["image", "text"],
    "complexity": { "score": 0.42, "band": "medium", "reasons": ["需视觉字段抽取"] },
    "urgency": { "level": "normal", "reasons": [] },
    "vision": {
      "required": true,
      "image_roles": ["source_document"],
      "expected_extraction": ["amount", "merchant", "datetime", "payment_method"]
    },
    "candidate_capabilities": ["bookkeeping.expense.record"],
    "required_capabilities": ["vision.extract", "ledger.write", "category.infer"],
    "data_sensitivity": "financial",
    "estimated_scale": { "input_tokens_bucket": "s", "output_tokens_bucket": "m", "est_tool_calls": 4 },
    "est_cost": { "currency": "CNY", "min": 0.004, "max": 0.021, "basis": "pricing.yaml@v3" },
    "est_latency_ms": { "min": 1400, "max": 7000 },
    "recommended_mode": "async",
    "needs_clarification": false,
    "clarification": null,
    "confidence": 0.86,
    "degraded": false,
    "profile_cache": { "hit": false, "key": null, "source_task_id": null, "similarity": null },
    "evaluator": { "tier": "cheap", "model_resolved": "<resolved-by-config>", "escalated_from": null, "latency_ms": 412, "tokens": { "in": 1180, "out": 96 } }
  },
  "decision": {
    "decision_version": "1.0",
    "policy_version": "pv_2026-10-01_03",
    "route_id": "vision_extract_then_write",
    "path": "decompose",
    "model_tier": "standard",
    "vision_tier": "standard",
    "handler": "bookkeeping",
    "tool_set": ["extract_receipt_fields", "normalize_merchant", "dedupe_check", "build_ledger_entry"],
    "execution_mode": "async",
    "decompose": true,
    "parallelism_hint": 2,
    "budget": { "max_cost": 0.05, "max_wall_ms": 30000, "max_llm_calls": 8 },
    "escalation_rule": { "on": ["schema_validation_failed", "low_quality"], "to_tier": "strong", "max_escalations": 1 },
    "rationale": "含支付截图，需视觉抽取后落账；去重依赖抽取结果，步骤间有依赖，故走 decompose 异步。",
    "confidence": 0.83,
    "guard": { "applied": ["budget_clamped"], "original_tier": null, "original_route_id": "vision_extract_then_write", "original_mode": "async", "fallback_used": false, "violations": [] }
  },
  "plan": {
    "strategy": "dag",
    "revision": 1,
    "source": "flow_template:receipt_to_entry",
    "max_parallelism": 3,
    "nodes": [
      {
        "subtask_id": "extract",
        "name": "视觉抽取票据字段",
        "status": "succeeded",
        "progress": 1.0,
        "attempts": 1,
        "tier": "standard",
        "started_at": "2026-10-06T12:00:00.4Z",
        "ended_at": "2026-10-06T12:00:03.5Z",
        "cost": { "amount": 0.0078, "currency": "CNY" },
        "output_preview": { "amount": 38.0, "merchant": "某某餐厅", "payment_method": "微信支付" },
        "error": null
      },
      {
        "subtask_id": "normalize",
        "name": "商户归类",
        "status": "running",
        "progress": 0.4,
        "attempts": 1,
        "tier": "cheap",
        "started_at": "2026-10-06T12:00:03.5Z",
        "ended_at": null,
        "cost": null,
        "output_preview": null,
        "error": null
      },
      {
        "subtask_id": "dedupe",
        "name": "重复检查",
        "status": "running",
        "progress": 0.2,
        "attempts": 1,
        "tier": "cheap",
        "started_at": "2026-10-06T12:00:03.5Z",
        "ended_at": null,
        "cost": null,
        "output_preview": null,
        "error": null
      },
      {
        "subtask_id": "write",
        "name": "写入账本",
        "status": "pending",
        "progress": 0.0,
        "attempts": 0,
        "tier": null,
        "started_at": null,
        "ended_at": null,
        "cost": null,
        "output_preview": null,
        "error": null
      }
    ]
  },
  "artifacts": null,
  "budget": {
    "max_cost": 0.05,
    "spent": 0.0078,
    "currency": "CNY",
    "max_wall_ms": 30000,
    "elapsed_ms": 2100,
    "enforcement": "advisory",
    "warned": false
  },
  "clarification": null,
  "error": null,
  "stage_notes": {
    "evaluation": ["画像缓存命中（请求规范化哈希一致）"],
    "routing": [],
    "planning": ["模板 receipt_to_entry 命中，跳过自由拆解"]
  },
  "policy_version": "pv_2026-10-01_03",
  "created_at": "2026-10-06T12:00:00Z",
  "updated_at": "2026-10-06T12:00:03.6Z",
  "ended_at": null,
  "links": {
    "events_url": "/v1/tasks/task_01J8ZQ5N7P/events",
    "result_url": "/v1/tasks/task_01J8ZQ5N7P/result"
  }
}
